{
  "$schema": "https://cortex.local/schemas/steal-inventory.json",
  "audited_iso": "2026-05-23T00:00:00Z",
  "target_path": "C:\\Users\\kumsatwi\\Desktop\\StEp\\personalProject\\connect4private\\nexus-os",
  "target_type": "other",
  "commit": {
    "sha": "b7776cbaea1e8817937f704a1edecb06512cfab5",
    "branch": "phase-4",
    "date": "2026-05"
  },
  "mode": "full",
  "prior_sha": null,
  "partial_reason": null,
  "features": [
    {
      "id": 1,
      "name": "NexusEventBus typed pub/sub",
      "file": "api/bus.py",
      "line": 7,
      "func": "NexusEventBus",
      "description": "In-process typed event bus: subscribe(EventType, Callable), emit(EventEnvelope). Persists events per-session to JSONL. Relays USER_SIGNAL events to JSONL bridge file.",
      "bucket": "A",
      "phase_ref": "43.1",
      "flaw_ref": null,
      "principle_violated": null,
      "score": null,
      "severity": null,
      "fit": null,
      "effort": null,
      "confidence": null,
      "counter_case": null,
      "inherited": false,
      "last_modified": "2026-05",
      "has_tests": false
    },
    {
      "id": 2,
      "name": "EventEnvelope with correlation_id threading",
      "file": "api/schemas.py",
      "line": 21,
      "func": "EventEnvelope",
      "description": "Pydantic typed event envelope: event_id (UUID), type (enum), timestamp, source, target, correlation_id, session_id, payload. correlation_id chains request→response across async hops, enabling audit trail per tool call.",
      "bucket": "E",
      "phase_ref": null,
      "flaw_ref": 47,
      "principle_violated": null,
      "score": 18,
      "severity": 3,
      "fit": 3,
      "effort": 2,
      "confidence": "medium",
      "counter_case": "Cortex's sync MCP call model has no inherent async chains to correlate — the overhead may exceed the benefit until multi-agent (Phase 43) lands.",
      "inherited": false,
      "last_modified": "2026-05",
      "has_tests": false
    },
    {
      "id": 3,
      "name": "Session-scoped JSONL event sourcing",
      "file": "api/bus.py",
      "line": 52,
      "func": "_persist_event",
      "description": "Each session writes events_<session_id>.jsonl to persistence dir. Complete typed event history survives restarts; enables log replay and audit.",
      "bucket": "E",
      "phase_ref": null,
      "flaw_ref": 14,
      "principle_violated": null,
      "score": 18,
      "severity": 3,
      "fit": 3,
      "effort": 2,
      "confidence": "high",
      "counter_case": "Cortex already has experience.jsonl and log.jsonl — adding session-scoped files adds more fragmentation to the already balkanized storage (flaw #55).",
      "inherited": false,
      "last_modified": "2026-05",
      "has_tests": false
    },
    {
      "id": 4,
      "name": "usage-report.py real Claude Code cost analytics",
      "file": "scratch/usage-limit-reducer/scripts/usage-report.py",
      "line": 82,
      "func": "collect",
      "description": "Reads ~/.claude/projects/*/*.jsonl (actual Claude Code session logs). Breaks down by model/project/day. Computes real cache hit %, API cost estimates, heuristic callouts. --json for machine output.",
      "bucket": "E",
      "phase_ref": null,
      "flaw_ref": 6,
      "principle_violated": null,
      "score": 60,
      "severity": 4,
      "fit": 5,
      "effort": 1,
      "confidence": "high",
      "counter_case": "The JSONL schema in ~/.claude/projects/ is undocumented and could change across Claude Code versions, making this script fragile to upstream changes.",
      "inherited": false,
      "last_modified": "2026-05",
      "has_tests": true
    },
    {
      "id": 5,
      "name": "ConnectionManager safe broadcast + stale pruning",
      "file": "api/main.py",
      "line": 32,
      "func": "ConnectionManager",
      "description": "WebSocket pool: connect, disconnect, broadcast(). Iterates copy of connections list in broadcast; removes stale connections on send failure. Prevents RuntimeError on mutation during iteration.",
      "bucket": "C",
      "phase_ref": "8.1",
      "flaw_ref": null,
      "principle_violated": null,
      "score": 24,
      "severity": 2,
      "fit": 4,
      "effort": 1,
      "confidence": "high",
      "counter_case": "Phase 8.1 is a TypeScript server; the Python pattern translates but the list-copy trick is language-specific and may not be needed in Node.js event-loop semantics.",
      "inherited": false,
      "last_modified": "2026-05",
      "has_tests": false
    },
    {
      "id": 6,
      "name": "Permissive event enrichment on partial agent events",
      "file": "api/main.py",
      "line": 104,
      "func": "watch_outbound_bridge",
      "description": "Fills missing fields (event_id, type, source, target, session_id, timestamp) on partial events written by the agent before injecting into bus. Prevents Pydantic validation failures from incomplete agent output.",
      "bucket": "C",
      "phase_ref": "43.1",
      "flaw_ref": null,
      "principle_violated": null,
      "score": 18,
      "severity": 2,
      "fit": 3,
      "effort": 1,
      "confidence": "medium",
      "counter_case": "Permissive enrichment hides schema drift — if an agent starts omitting a field the server silently fills it, masking a bug. Cortex's strict Pydantic approach is actually safer.",
      "inherited": false,
      "last_modified": "2026-05",
      "has_tests": false
    },
    {
      "id": 7,
      "name": "Ghost Bridge dual-WebSocket fast lane",
      "file": "api/main.py",
      "line": 170,
      "func": "ghost_bridge_socket",
      "description": "Dedicated /ws/ghost WebSocket for streaming IDE snapshots, separate from /ws/nexus event socket. Low-latency path bypasses event bus overhead for high-frequency streaming.",
      "bucket": "C",
      "phase_ref": "8.1",
      "flaw_ref": null,
      "principle_violated": null,
      "score": 12,
      "severity": 2,
      "fit": 3,
      "effort": 2,
      "confidence": "medium",
      "counter_case": "Two WebSocket endpoints adds operational complexity; Cortex's single Phase 8.1 endpoint with message-type routing is simpler for the graph-stream use case.",
      "inherited": false,
      "last_modified": "2026-05",
      "has_tests": false
    },
    {
      "id": 8,
      "name": "text.chunk / text.final streaming event types",
      "file": "api/schemas.py",
      "line": 18,
      "func": "EventType.TEXT_CHUNK",
      "description": "Dedicated enum values for streaming token output: TEXT_CHUNK for incremental tokens, TEXT_FINAL for complete response. Enables client-side progressive rendering of LLM output.",
      "bucket": "C",
      "phase_ref": "8.1",
      "flaw_ref": null,
      "principle_violated": null,
      "score": 12,
      "severity": 2,
      "fit": 3,
      "effort": 2,
      "confidence": "medium",
      "counter_case": "Cortex's Phase 8.1 streams graph state changes, not LLM token output — the text.chunk pattern is only relevant if Cortex adds a live synthesis output stream, which isn't planned.",
      "inherited": false,
      "last_modified": "2026-05",
      "has_tests": false
    },
    {
      "id": 9,
      "name": "Agent persona loading from BOOTSTRAP.md markers",
      "file": "api/nexus_ai_engine.py",
      "line": 120,
      "func": "_load_persona_from_bootstrap",
      "description": "Reads BOOTSTRAP.md for ACTIVATE @<agent-name> marker, extracts following persona line. No server restart needed — live file re-read per request. Fallback to default persona.",
      "bucket": "C",
      "phase_ref": "4.8",
      "flaw_ref": null,
      "principle_violated": null,
      "score": 12,
      "severity": 2,
      "fit": 3,
      "effort": 2,
      "confidence": "medium",
      "counter_case": "Phase 4.8 plans MCP-level persona prompts which are more structured; file markers are a quick-and-dirty approach that doesn't scale to many agents.",
      "inherited": false,
      "last_modified": "2026-05",
      "has_tests": false
    },
    {
      "id": 10,
      "name": "JSONL file-based agent bridge (inbound/outbound)",
      "file": "api/bus.py",
      "line": 38,
      "func": "_relay_to_bridge",
      "description": "inbound.jsonl / outbound.jsonl for IDE↔backend agent communication. File bridge is local-first, no network, works cross-process.",
      "bucket": "B",
      "phase_ref": "43.1",
      "flaw_ref": null,
      "principle_violated": null,
      "score": null,
      "severity": null,
      "fit": null,
      "effort": null,
      "confidence": null,
      "counter_case": "Cortex's MCP protocol is a superior message transport — typed, bidirectional, streaming-capable, and already wired into Claude Code. File bridge is a workaround for IDE integration before a proper protocol exists.",
      "inherited": false,
      "last_modified": "2026-05",
      "has_tests": false
    },
    {
      "id": 11,
      "name": "Multi-model dispatch (Gemini + OpenAI routing)",
      "file": "api/nexus_ai_engine.py",
      "line": 80,
      "func": "_call_ai_api",
      "description": "Routes LLM calls to Gemini or OpenAI based on model string prefix. Graceful error on unknown provider.",
      "bucket": "A",
      "phase_ref": "0.14",
      "flaw_ref": null,
      "principle_violated": null,
      "score": null,
      "severity": null,
      "fit": null,
      "effort": null,
      "confidence": null,
      "counter_case": null,
      "inherited": false,
      "last_modified": "2026-05",
      "has_tests": false
    },
    {
      "id": 12,
      "name": "Runtime model switching via command",
      "file": "api/nexus_ai_engine.py",
      "line": 51,
      "func": "_handle_agent_logic",
      "description": "use model <name> text command dynamically re-routes an agent to a different LLM at runtime and persists choice to per-agent JSON config.",
      "bucket": "A",
      "phase_ref": "33.1",
      "flaw_ref": null,
      "principle_violated": null,